<?xml version="1.0" encoding="utf-8" ?>
<cms xmlns:xsi="http://www.w3.org/2001/XMLSchema-instance" xsi:noNamespaceSchemaLocation="https://raw.githubusercontent.com/shopwell-shop/shopwell/trunk/src/Core/Framework/App/Cms/Schema/cms-1.0.xsd">
<blocks>
    <block>
        <name>my-first-block</name>
        <category>text-image</category>

        <label>First block from app</label>
        <label lang="zh-CN">应用的第一个区块</label>

        <slots>
            <slot name="left" type="manufacturer-logo">
                <config>
                    <config-value name="display-mode" source="static" value="cover"/>
                </config>
            </slot>
            <slot name="middle" type="image-gallery">
                <config>
                    <config-value name="display-mode" source="static" value="auto"/>
                    <config-value name="min-height" source="static" value="300px"/>
                </config>
            </slot>
            <slot name="right" type="buy-box">
                <config>
                    <config-value name="display-mode" source="static" value="contain"/>
                </config>
            </slot>
        </slots>

        <default-config>
            <margin-bottom>20px</margin-bottom>
            <margin-top>20px</margin-top>
            <margin-left>20px</margin-left>
            <margin-right>20px</margin-right>
            <sizing-mode>boxed</sizing-mode>
            <background-color>#000</background-color>
        </default-config>
    </block>

    <block>
        <name>my-second-block</name>
        <category>text-image</category>

        <label>Second block from app</label>
        <label lang="zh-CN">应用的第二个区块</label>

        <slots>
            <slot name="left" type="form">
                <config>
                    <config-value name="display-mode" source="static" value="cover"/>
                </config>
            </slot>
            <slot name="middle" type="image">
                <config>
                    <config-value name="display-mode" source="static" value="auto"/>
                    <config-value name="background-color" source="static" value="red"/>
                </config>
            </slot>
            <slot name="right" type="youtube-video">
                <config>
                    <config-value name="display-mode" source="static" value="contain"/>
                </config>
            </slot>
        </slots>

        <default-config>
            <margin-bottom>20px</margin-bottom>
            <margin-top>20px</margin-top>
            <margin-left>20px</margin-left>
            <margin-right>20px</margin-right>
            <sizing-mode>boxed</sizing-mode>
            <background-color>#000</background-color>
        </default-config>
    </block>
</blocks>
</cms>
