<?xml version="1.0" encoding="utf-8" ?>
<cms xmlns:xsi="http://www.w3.org/2001/XMLSchema-instance" xsi:noNamespaceSchemaLocation="https://raw.githubusercontent.com/shopwell-shop/shopwell/trunk/src/Core/Framework/App/Cms/Schema/cms-1.0.xsd">
    <blocks>
        <block>
            <name>technical-block-name</name>
            <category>text-image</category>

            <label>Block from app</label>
            <label lang="zh-CN">应用区块</label>

            <slots>
                <slot name="left" type="form">
                    <config>
                        <config-value name="key" source="static" value="value"/>
                    </config>
                </slot>
                <slot name="left" type="image">
                    <config>
                        <config-value name="display-mode" source="static" value="cover"/>
                    </config>
                </slot>
            </slots>

            <default-config>
                <margin-bottom>20px</margin-bottom>
                <margin-top>20px</margin-top>
                <margin-left>20px</margin-left>
                <margin-right>20px</margin-right>
                <sizing-mode>boxed</sizing-mode>
                <background-color>#000</background-color>
            </default-config>
        </block>
    </blocks>
</cms>
